일자,브랜드,유형,제목,언론사,링크,요약
2026-06-29,투썸플레이스,혜택/프로모션/이벤트,"새마을금고, 시장愛 온 체크카드 선봬…""전통시장 할인 혜택""",newsdream.kr,http://www.newsdream.kr/news/articleView.html?idxno=113699,"대형마트(이마트 등), 슈퍼마켓(롯데슈퍼 등), 디저트(파리바게트 등) 및 커피전문점(투썸플레이스 등) 등에서는 5% 할인 서비스를 받을 수 있다. 통합할인 한도는 전월 이용실적에 따라 월 6000원부터 2만원까지다. 신규..."
2026-06-29,투썸플레이스,신제품 출시,"새마을금고, '시장愛 온' 체크카드 출시…온누리 가맹점 등 15% 할인",megaeconomy.co.kr,https://www.megaeconomy.co.kr/news/newsview.php?ncode=1065573807281550,"이와 함께 대형마트(이마트 등), 슈퍼마켓(롯데슈퍼 등), 디저트 전문점(파리바게뜨 등), 커피전문점(투썸플레이스 등)에서는 5% 할인 서비스를 받을 수 있다. 통합 할인 한도는 전월 이용 실적에 따라 월 6000원에서 최대..."
2026-06-29,투썸플레이스,신제품 출시,"새마을금고, 전통시장 특화 ‘시장愛 온’ 체크카드 출시",viva100.com,https://www.viva100.com/article/20260629500286,"이마트 등 대형마트와 롯데슈퍼 등 슈퍼마켓에서도 5% 할인을 받을 수 있으며, 파리바게트·투썸플레이스 등 디저트·커피 전문점 이용 시에도 동일하게 5% 할인이 제공된다. 통합 할인 한도는 전월 이용실적에 따라 월..."
2026-06-29,투썸플레이스,신제품 출시,전통시장도 대형마트도 할인...새마을금고 전용 체크카드 출시,eroun.net,https://www.eroun.net/news/articleView.html?idxno=84159,"또 대형마트(이마트 등)와 슈퍼마켓(롯데슈퍼 등), 디저트 전문점(파리바게트 등), 커피전문점(투썸플레이스 등)에서는 5% 할인 혜택을 받을 수 있다. 통합 할인 한도는 전월 이용실적에 따라 월 6000원부터 최대 2만 원까지..."
2026-06-29,투썸플레이스,혜택/프로모션/이벤트,"""전통시장 15% 깎아준다""…새마을금고, '시장愛온' 체크카드 선봬",joongangenews.com,https://www.joongangenews.com/news/articleView.html?idxno=528867,대형마트(이마트 등)·슈퍼마켓(롯데슈퍼 등)·디저트(파리바게트 등)·커피전문점(투썸플레이스 등) 등에서는 5% 할인 서비스를 받을 수 있다. 통합할인 한도는 전월 이용실적에 따라 월 6000원부터 2만원까지다. 신규 발급...
2026-06-29,투썸플레이스,혜택/프로모션/이벤트,"하나카드·새마을금고, 최고금리 상한제 도입...'시장愛 온' 체크카드 출...",wsobi.com,http://www.wsobi.com/news/articleView.html?idxno=314382,"대형마트(이마트 등), 슈퍼마켓(롯데슈퍼 등), 디저트(파리바게트 등) 및 커피전문점(투썸플레이스 등) 등에서는 5% 할인 서비스를 받을 수 있다. 통합할인 한도는 전월 이용실적에 따라 월 6천원부터 2만원까지다. 신규..."
2026-06-29,투썸플레이스,신제품 출시,"새마을금고, '시장愛 온' 체크카드 출시",enewstoday.co.kr,http://www.enewstoday.co.kr/news/articleView.html?idxno=2443212,"대형마트(이마트 등), 슈퍼마켓(롯데슈퍼 등), 디저트(파리바게트 등) 및 커피전문점(투썸플레이스 등) 등에서는 5% 할인 서비스를 받을 수 있다. 통합할인 한도는 전월 이용실적에 따라 월 6000원부터 2만원까지다. 신규..."
2026-06-29,투썸플레이스,신제품 출시,"새마을금고, 전통시장 특화 '시장愛 온' 체크카드 출시",ziksir.com,https://www.ziksir.com/news/articleView.html?idxno=138269,"이마트 등 대형마트와 롯데슈퍼 등 슈퍼마켓, 파리바게뜨 등 디저트 매장, 투썸플레이스 등 커피전문점에서는 5% 할인 서비스를 제공한다. 통합 할인 한도는 전월 이용실적에 따라 월 6000원부터 최대 2만원까지 적용된다...."
2026-06-29,투썸플레이스,신제품 출시,"투썸플레이스, K-델리 스타일 신제품 선봬",bokuennews.com,http://www.bokuennews.com/news/article.html?no=280399,"바쁜 일상 속에서 가볍게 한 끼를 해결하는 '스내킹(snacking)' 문화가 확산되면서, 간편하면서도 만족감 높은 이른바 '시성비(시간 대비 성능)' 메뉴를 찾는 소비자가 늘고 있다 투썸플레이스가 바쁜 현대인을 겨냥한..."
2026-06-29,메가커피,기타 이슈,정부 ‘3대 메가프로젝트’…경남 ‘피지컬AI’ 언급 없어,news.kbs.co.kr,https://news.kbs.co.kr/news/pc/view/view.do?ncd=8597621&ref=A,"[리포트] 집까지 택배 상자를 나르고, 커피를 뽑아 건네는 로봇. 모두 사람처럼 스스로 상황을 인지하고 행동하는 '피지컬 인공지능'입니다. 정부는 앞으로 3년을 '피지컬AI' 세계 1강을 위한 골든타임으로 보고, '3대 메가..."
2026-06-29,메가커피,기타 이슈,[영상] 전재수 “취임식 없이 곧바로 업무… 이르면 30일 경제부시장 발...,busan.com,https://www.busan.com/view/busan/view.php?code=2026062918291356078,그래야 시민이 행정을 신뢰할 수 있다.” -부울경 행정통합과 메가시티는 어떻게 보나. “당장 내년과... 과거 구포 개시장 정비 때도 커피숍과 과일가게 등으로 전업시키며 상인들의 생계를 모두 책임졌다. 오히려...
2026-06-29,메가커피,기타 이슈,정부 ‘3대 메가프로젝트’…경남 ‘피지컬AI’ 언급 없어,news.kbs.co.kr,https://news.kbs.co.kr/news/pc/view/view.do?ncd=8597408&ref=A,"[리포트] 집까지 택배 상자를 나르고, 커피를 뽑아 건네는 로봇. 모두 사람처럼 스스로 상황을 인지하고 행동하는 '피지컬 인공지능'입니다. 정부는 앞으로 3년을 '피지컬AI' 세계 1강을 위한 골든타임으로 보고, '3대 메가..."
2026-06-29,메가커피,신제품 출시,"메가MGC커피, 춘천 찰토마토 활용 신메뉴로 지역 상생 나서",ekn.kr,https://www.ekn.kr/web/view.php?key=20260629022317509,춘천 찰토마토가 메가MGC커피 여름 신메뉴 재료로 쓰인다. 메가MGC커피는 춘천시와 지역농산물 소비 촉진 협약을 맺고 지역 농산물의 판로를 넓히기로 했다. 메가MGC커피는 춘천시와 지역농산물 소비 촉진을 위한...
2026-06-29,메가커피,신제품 출시,"메가MGC커피, 춘천시와 지역 상생 나서",busan.com,https://www.busan.com/view/busan/view.php?code=2026062917061831191,"메가MGC커피가 강원도 춘천시와 손잡고 지역 상생에 나선다. 메가MGC커피는 춘천시청에서 춘천시와 지역농산물 소비 촉진을 위한 업무 협약을 체결하고, 춘천 특산물인 찰토마토를 활용한 여름 신메뉴를 선보인다고 29일..."
2026-06-29,메가커피,신제품 출시,"메가MGC커피, 춘천시와 ‘지역 상생’ MOU…찰토마토 활용 여름 신메뉴...",megaeconomy.co.kr,https://www.megaeconomy.co.kr/news/newsview.php?ncode=1065600121331231,"메가MGC커피가 강원도 춘천시와 손잡고 지역 농산물 소비 촉진과 상생 협력 강화에 나선다. 메가MGC커피는 춘천시청에서 춘천시와 ‘지역농산물 소비 촉진을 위한 업무협약(MOU)’을 체결하고, 춘천 특산물인 찰토마토를..."
2026-06-29,메가커피,기타 이슈,"메가MGC커피, 춘천시와 MOU 체결... 지역 상생 행보 본격화",newslock.co.kr,http://www.newslock.co.kr/news/articleView.html?idxno=132347,"메가MGC커피가 강원도 춘천시와 손잡고 지역 상생을 위한 행보에 본격적으로 나선다. 메가MGC커피는 춘천시청에서 춘천시와 '지역농산물 소비 촉진을 위한 업무 협약(MOU)'을 체결하고, 춘천 특산물인 찰토마토를 활용한..."
2026-06-29,메가커피,신제품 출시,"메가MGC커피, 춘천시와 맞손…찰토마토 신메뉴 선봬",sports.hankooki.com,https://sports.hankooki.com/news/articleView.html?idxno=6935667,"ⓒ메가MGC커피 메가MGC커피는 춘천시와 '지역농산물 소비 촉진을 위한 업무협약(MOU)'을 진행하고, 춘천 특산물인 찰토마토를 활용한 여름 신메뉴를 출시한다고 29일 밝혔다. 회사에 따르면 이번 협약은 춘천 찰토마토의..."
2026-06-29,메가커피,신제품 출시,[오늘의 카페] 메가MGC커피·팀홀튼·공차코리아·더벤티,financialreview.co.kr,http://www.financialreview.co.kr/news/articleView.html?idxno=43206,"/사진=메가MGC커피 #메가MGC커피, 춘천시와 MOU 체결... '춘천 토마토' 더한 상생 신메뉴로 여름 시장 조준 대한민국 대표 커피 브랜드 메가MGC커피가 강원도 춘천시와 손잡고 지역 상생을 위한 행보에 본격적으로 나선다...."
2026-06-29,메가커피,기타 이슈,32강 잔치 끝났다...월드컵 특수 꺼진 유통가엔 ‘한숨만’[북중미 월드...,etoday.co.kr,https://www.etoday.co.kr/news/view/2598358,하이트진로나 메가MGC커피처럼 손흥민을 단독 모델로 기용한 기업들은 선수 개인의 브랜드 파워가 유지돼 타격이 덜하다. 반면 경기 당일 수요에 맞춘 공식 스폰서 기업들은 마케팅 동력이 끊겨 차라리 스폰서로...
2026-06-29,메가커피,신제품 출시,전국 메가커피서 맛보는 춘천 소양강 찰토마토,kado.net,https://www.kado.net/news/articleView.html?idxno=2058398,"춘천시와 국내 유명 커피 프랜차이즈인 메가커피가 소양강 찰토마토를 활용한 계절 한정 메뉴를 선보인다. 춘천시와 메가MGC커피는 22일 춘천시청에서 육동한 시장, 김대영 회장 등이 참석한 가운데 '지역 농산물 소비..."
2026-06-29,메가커피,기타 이슈,저가 커피 엑시트 시대…컴포즈커피 '뷔 카드'는 누구를 위한 것이었나,sports.hankooki.com,https://sports.hankooki.com/news/articleView.html?idxno=6935657,"메가MGC커피는 2021년 프리미어파트너스 등이 참여한 투자목적회사(SPC)에 인수됐으며, 컴포즈커피는 2024년 필리핀 외식기업 졸리비푸드와 사모펀드 엘리베이션프라이빗에쿼티(엘리베이션PE) 컨소시엄에 약 4700억원에..."
2026-06-29,메가커피,혜택/프로모션/이벤트,[은행街소식]하나금융그룹ㆍNH농협은행ㆍ새마을금고ㆍIBK기업은행,smarttimes.co.kr,http://www.smarttimes.co.kr/news/articleView.html?idxno=46806,"이번 사업은 광양황금에너지저장소가 전남 광양에 99.75㎿(메가와트), 750㎿h(메가와트시) 규모의 에너지... 대형마트와 슈퍼마켓, 커피전문점 등에서는 5% 할인된다. 통합 할인 한도는 전월 이용실적에 따라 월 6천원에서..."
2026-06-29,메가커피,굿즈/MD,[A오늘의 유통] CJ제일제당·컬리·하이트진로·쿠팡·락앤락 外,asiaa.co.kr,https://www.asiaa.co.kr/news/articleView.html?idxno=253638,"캐나다의 대표적인 커피와 디저트, 브랜드 굿즈를 활용해 국내 고객에게 캐나다 문화와 브랜드 정체성을... 쿠팡은 지난 27일~28일 부산아시아드주경기장에서 열린 BOF에서 쿠팡의 대표적인 뷰티 축제인 '메가뷰티쇼' 홍보..."
2026-06-29,메가커피,신제품 출시,"메가MGC커피, '춘천 토마토' 활용 여름 신메뉴 선보인다",hg-times.com,https://www.hg-times.com/news/articleView.html?idxno=303149,"한강타임즈 김광호 기자 = 메가MGC커피는 춘천시와 '지역농산물 소비 촉진을 위한 업무 협약(MOU)'을 체결하고, 춘천 특산물인 찰토마토를 활용한 여름 신메뉴를 선보인다고 29일 밝혔다. 메가MGC커피에 따르면 이번 협약은..."
2026-06-29,메가커피,기타 이슈,"[포토뉴스] 춘천시·메가MGC커피, 업무협약 체결 ··· 7월 초 토마토 활...",gw.newdaily.co.kr,https://gw.newdaily.co.kr/site/data/html/2026/06/29/2026062900238.html,뉴데일리 이달수 기자 = 뉴데일리 이달수
2026-06-29,메가커피,신제품 출시,[현장+] 발효유 넘어 균주 경쟁력으로…hy 평택공장에 가보니,m-i.kr,https://www.m-i.kr/news/articleView.html?idxno=1386252,메가MGC커피와 협업 제품 출시 이후 주문량이 증가하면서 생산라인도 풀가동에 가까운 수준으로 운영되고 있다는 설명이다. hy 평택 생산시설 전경. 사진=hy 제공. 하지만 평택공장의 역할은 발효유 생산에만 머물지...
2026-06-29,메가커피,신제품 출시,"춘천 소양강 찰토마토, 전국 메가MGC커피 매장서 신메뉴로 만난다",kwnews.co.kr,https://www.kwnews.co.kr/article/20260629500653,춘천 소양강 찰토마토가 전국 메가MGC커피 매장에서 소비자들을 만난다. 춘천시는 최근 전국 최대 규모 커피 프랜차이즈인 메가MGC커피(회장:김대영)와 지역농산물 소비촉진 업무 협약을 맺었다. 이번 협약을 통해 시와...
2026-06-29,메가커피,혜택/프로모션/이벤트,"[유통레이더] 교촌치킨, 쿠팡, 마녀공장, 리만코리아, 컬리, 이브자리 外",daily.hankooki.com,https://daily.hankooki.com/news/articleView.html?idxno=1380637,"사진= 쿠팡 제공 ◇쿠팡, 부산원아시아페스티벌서 '메가뷰티쇼' 사전 홍보 부스 운영 쿠팡은 지난 27~28일... 캐나다 데이 당일인 1일에는 캐나다 국민 커피 '더블더블'과 '허니 글레이즈드 도넛'을 1+1으로 제공한다...."
2026-06-29,메가커피,혜택/프로모션/이벤트,"[스포츠TMI](5) '역발상' 리바이스, 월드컵 경기장 이름이 달라진 이유",hansbiz.co.kr,http://www.hansbiz.co.kr/news/articleView.html?idxno=847016,/메가MGC커피 제공 이처럼 월드컵을 비롯한 대형 스포츠 이벤트에선 '앰부시(매복) 마케팅'을 막기 위한 대회 조직위원회와 기업 간의 수싸움이 치열하다. 일례로 FIFA는 이번 대회에서 링컨 파이낸셜 필드를 '필라델피아...
2026-06-29,메가커피,신제품 출시,가수·의전 없이 '2만4000명' 홀린 경산 카페 축제 성료,ajunews.com,https://www.ajunews.com/view/20260629134445791,없이도 메가 히트를 기록한 새로운 축제 패러다임을 선보였다. (재)경산문화관광재단은 지난 27일 남천 둔치... 현장에는 관내 17개 소상공인 및 대형 카페가 참여해 자체 개발한 신비복숭아 스페셜티 커피와 디저트 빵을...
2026-06-29,메가커피,기타 이슈,"메가MGC커피, 춘천시와 MOU 체결... 지역 농산물 소비 촉진 나서",globalepic.co.kr,http://www.globalepic.co.kr/view.php?ud=20260629132007542448439a4874_29,"대한민국 대표 커피 브랜드 메가MGC커피가 강원도 춘천시와 손을 잡고 지역 농산물 소비 촉진과 경제 활성화를 위한 본격적인 행보에 나섰다. 이번 협약은 단순한 기업 간의 비즈니스를 넘어, 지자체와 본사, 그리고 일선..."
2026-06-29,메가커피,기타 이슈,환율·원가·인건비 삼중고 … 유통·외식 가격 인상 압박 커진다 [벼랑...,biz.newdaily.co.kr,https://biz.newdaily.co.kr/site/data/html/2026/06/29/2026062900039.html,"더벤티와 이디야커피, 메가커피, 커피빈 등 커피 프랜차이즈도 100~500원 가격을 올렸다. 식품업계 관계자는 “환율과 원재료, 인건비 부담이 동시에 확대되고 있다”면서 “상승폭이 가파른 만큼 하반기 품목별..."
2026-06-29,메가커피,신제품 출시,"메가MGC커피, 춘천시와 맞손… '소양강 찰토마토' 여름 신메뉴로 지역 ...",newscj.com,https://www.newscj.com/news/articleView.html?idxno=3412837,메가MGC커피가 춘천시와 '지역농산물 소비 촉진을 위한 업무협약(MOU)'을 체결하고 춘천 특산물인 찰토마토를 활용한 여름 신메뉴를 선보인다고 29일 밝혔다. 이번 협약은 우수한 품질의 춘천 찰토마토 인지도 제고와 판로...
2026-06-29,메가커피,기타 이슈,[2026부동산세미나] 불확실성 커진 부동산 시장···전문가 5인 한자리...,sisajournal-e.com,https://www.sisajournal-e.com/news/articleView.html?idxno=422047,온라인 라이브로 진행되는 이번 세미나 도중 실시간 채팅으로 질문을 남기는 시청자(총 100명)에게는 추첨을 통해 1만원 상당의 메가커피 상품권을 각각 제공한다. 행사 관련 문의는 전화(02-6716-4400)로 하면 된다.
2026-06-29,메가커피,신제품 출시,"메가MGC커피, 춘천시와 맞손…'찰토마토' 여름 신메뉴로 지역 상생",news.bbsi.co.kr,https://news.bbsi.co.kr/news/articleView.html?idxno=4091828,"커피 브랜드 메가MGC커피가 강원도 춘천시와 손잡고 지역 농산물 소비 촉진과 상생을 위한 행보에 나섭니다. 메가MGC커피는 오늘 춘천시청에서 업무 협약을 체결하고, 춘천의 대표 특산물인 소양강 찰토마토를 활용한 여름..."
2026-06-29,메가커피,신제품 출시,"메가MGC커피, 춘천시와 협업 '춘천 토마토' 여름 시장 공략",100ssd.co.kr,https://www.100ssd.co.kr/news/articleView.html?idxno=210635,"메가MGC커피가 강원도 춘천시와 협업, '춘천 토마토'를 더한 상생 신메뉴로 여름 시장을 공략한다. 메가MGC커피는 춘천시청에서 춘천시와 '지역농산물 소비 촉진을 위한 업무협약'을 체결, 지역 상생을 위한 행보에 본격..."
2026-06-29,메가커피,기타 이슈,"해외영토 확장하는 K커피…더벤티, 필리핀 진출 본격화",mk.co.kr,https://www.mk.co.kr/article/12085354,"현지 기업과 마스터 프랜차이즈 계약 2026년 3분기 내 필리핀 1호점 오픈 빽다방·메가커피 등도 해외 진출 심혈 커피 프랜차이즈 더벤티가 동남아 시장 확장을 위해 필리핀 진출을 본격화한다. 더벤티는 캐나다, 베트남..."
2026-06-29,메가커피,신제품 출시,초특가∙보양식∙지역상생…여름 식탁 공략법 다양해진다,kdfnews.com,http://www.kdfnews.com/news/articleView.html?idxno=184666,메가MGC커피는 춘천시와 업무협약(MOU)을 체결하고 지역 특산물인 춘천 찰토마토를 활용한 여름 신메뉴를 선보인다. 이번 협약에는 춘천 지역 가맹점주들도 직접 참여해 지역 농산물 소비 촉진과 지역 경제 활성화에 힘을...
2026-06-29,메가커피,기타 이슈,커피값 부담에 홈카페 뜬다…아이스 스틱·캡슐커피 경쟁,newsprime.co.kr,http://www.newsprime.co.kr/news/article.html?no=738261,"메가MGC커피는 지난 19일부터 할메가커피, 왕할메가커피, 할메가미숫커피 등 3종 가격을 각각 200원 인상했다. 더벤티도 지난달 29일부터 아메리카노를 제외한 일부 음료 11종 가격을 100~500원 올렸다. 저가 커피 브랜드까지..."
2026-06-29,메가커피,혜택/프로모션/이벤트,"KB 페이(KB Pay) 앱으로 통합된 '리브메이트', 6월 29일 월요일 자 '오늘...",bizwnews.com,http://www.bizwnews.com/news/articleView.html?idxno=139572,"지난 27일이번 문제는 ""KB Pay 첫 만남 기념 이벤트에 참여하면 받을 수 있는 혜택은 무엇일까요?""로 정답은 '메가MGC커피 ICE 아메리카노 쿠폰'이었다. 지난 26일 출제된 문제는 ""KB Pay 쇼핑 '루메나 데이..."
2026-06-29,메가커피,신제품 출시,"메가MGC커피, 춘천 손잡고 '찰토마토 음료' 선보인다",widedaily.com,https://www.widedaily.com/news/articleView.html?idxno=296577,메가MGC커피가 강원도 춘천시와 손잡고 지역 특산물인 찰토마토를 활용한 여름 신메뉴를 선보인다고 29일 밝혔다. 메가MGC커피는 지난 22일 춘천시청에서 춘천시와 '지역농산물 소비 촉진을 위한 업무협약(MOU)'을...
2026-06-29,메가커피,신제품 출시,"메가MGC커피, 춘천시와 찰토마토 소비 촉진 MOU…지역상생·메뉴 경쟁력...",pointdaily.co.kr,https://www.pointdaily.co.kr/news/articleView.html?idxno=309899,메가MGC커피(이하 메가커피)는 춘천시와 '지역농산물 소비 촉진을 위한 업무 협약(MOU)'을 체결하고 춘천 특산물인 찰토마토를 활용한 여름 신메뉴를 선보인다고 29일 밝혔다. 이번 협약은 지역 사회와의 동반 성장을...
2026-06-29,메가커피,신제품 출시,"[게시판] 메가MGC커피, 춘천시와 업무협약 맺고 찰토마토 신메뉴 출시",yna.co.kr,https://www.yna.co.kr/view/AKR20260629022300030?input=1195m,▲ 메가MGC커피는 강원 춘천시와 지역 농산물 소비 촉진을 위한 업무협약(MOU)을 체결하고 춘천 특산물인 찰토마토를 활용한 여름 신메뉴를 선보인다고 29일 밝혔다. 양측은 찰토마토 인지도를 높이고 판로를 확대해...
2026-06-29,메가커피,기타 이슈,"메가MGC커피, 춘천시와 협약 체결…토마토 활용 메뉴 도입",lawissue.co.kr,http://www.lawissue.co.kr/view.php?ud=202606290915414552204ead0791_12,메가MGC커피가 춘천시와 지역 농산물 활용 협약을 체결했다고 29일 밝혔다. 찰토마토를 활용한 메뉴 구성이 포함됐다. 이번 협약은 지역 농산물 소비 확대를 위한 협력 형태로 진행됐다. 춘천 지역 특산물인 찰토마토를...
2026-06-29,메가커피,신제품 출시,"메가MGC커피, 춘천 손잡고 '찰토마토 음료' 선보인다",newsis.com,https://www.newsis.com/view/NISX20260629_0003687063,메가MGC커피가 강원도 춘천시와 손잡고 지역 특산물인 찰토마토를 활용한 여름 신메뉴를 선보인다고 29일 밝혔다. 메가MGC커피는 지난 22일 춘천시청에서 춘천시와 '지역농산물 소비 촉진을 위한 업무협약(MOU)'을...
2026-06-29,메가커피,굿즈/MD,2026 올해의 캠페인은? … 6월 29일 ~ 7월 12일 대국민 소비자 투표 실시,socialvalue.kr,https://www.socialvalue.kr/news/view/1065590361153101,위드 롯데 ▲메가MGC커피 SMGC 캠페인 ▲에어비앤비 X 하이브 K컬처 협업 캠페인이 후보로 선정됐다 역사와 보훈의 가치를 현대적으로 알리는 캠페인도 꾸준히 확산되고 있다. 애국보훈 캠페인 부문에는 ▲KB금융그룹...
2026-06-29,메가커피,신제품 출시,메가커피 춘천 찰토마토 MOU·동원홈푸드 '저당 딜라이트 마요' 출시 外,slist.kr,https://www.slist.kr/news/articleView.html?idxno=748282,메가MGC커피는 춘천시와 '지역농산물 소비 촉진을 위한 업무 협약'을 맺고 춘천 찰토마토를 활용한 여름 신메뉴를 선보인다. 이번 협약은 춘천 특산물 인지도 제고와 판로 확대를 통해 지역 경제 활성화에 기여하려는...
2026-06-29,메가커피,신제품 출시,"메가MGC커피, 춘천과 '지역농산물 소비' MOU…찰토마토 신메뉴 개발",news1.kr,https://www.news1.kr/industry/distribution/6210883,메가MGC커피는 춘천시와 '지역농산물 소비 촉진을 위한 업무 협약'(MOU)을 체결하고 춘천 특산물인 찰토마토를 활용한 여름 신메뉴를 선보인다고 29일 밝혔다. 메가MGC커피는 신메뉴 출시를 통해 소비자들에게는 신선하고...
2026-06-29,메가커피,신제품 출시,"메가MGC커피, 춘천시와 MOU 체결...상생메뉴 출시",edaily.co.kr,https://www.edaily.co.kr/news/newspath.asp?newsid=02125446645486640,커피 브랜드 메가MGC커피가 강원도 춘천시와 손잡고 지역 상생에 나선다. 김대영 메가MGC커피 회장(사진 왼쪽 세번째)이 육동한 춘천시장(오른쪽 세번째)과 협약서 체결 후 기념 촬영을 하고 있다. (사진=메가MGC커피 제공)...
2026-06-29,컴포즈커피,굿즈/MD,"패스오더, 더벤티와 제휴 확대...여름 시즌 메뉴 판매·신규 고객 유입...",thepowernews.co.kr,https://www.thepowernews.co.kr/view.php?ud=2026062612010530149aeda69934_7,"컴포즈커피와 빽다방에 이어 더벤티까지 파트너십을 확대하며 국내 주요 저가 커피 브랜드와의 협업을 강화하고, 플랫폼 경쟁력을 한층 높인다는 전략이다. 최근 커피 소비 시장에서는 하나의 브랜드 앱만 이용하기보다..."
2026-06-29,컴포즈커피,기타 이슈,"패스오더, '더벤티'와 제휴… 여름 대목 겨냥한 '성수기 매출 확대' 시너...",e2news.com,http://www.e2news.com/news/articleView.html?idxno=331691,"패스오더는 앞서 컴포즈커피, 빽다방, SPC 파리바게뜨, 텐퍼센트스페셜티커피, 하삼동커피, 더리터 등 국내 유수 프랜차이즈와 파트너십을 체결한 바 있다. 특히 더벤티는 최근 '추억의 수박화채 마빙(마시는 빙수)', '이천쌀..."
2026-06-29,컴포즈커피,기타 이슈,"컴포즈커피 본진에 도전장 내민 더벤티...저가 커피 업체, 해외서 붙는...",newsworker.co.kr,http://www.newsworker.co.kr/news/articleView.html?idxno=433596,"국내 저가 커피 프랜차이즈 더벤티가 필리핀 진출을 본격화하면서 현지 시장을 선점하려는 컴포즈커피와 맞대결을 예고했다. 국내에서는 컴포즈커피가 많은 매장 수를 앞세우지만, 두 브랜드 모두 비슷한 시기에 필리핀..."
2026-06-29,컴포즈커피,기타 이슈,"'더벤티', 카페 플랫폼 '패스오더'와 제휴… 여름 성수기 시즌 메뉴 판매...",fntoday.co.kr,https://www.fntoday.co.kr/news/articleView.html?idxno=387033,"최근 컴포즈커피, 빽다방, SPC 파리바게뜨, 텐퍼센트스페셜티커피, 하삼동커피, 더리터 등 국내 주요 프랜차이즈들이 자사 앱 운영과 더불어 패스오더와의 파트너십을 결합하는 사례도 빠르게 늘어나는 추세다. 특히..."
