일자,브랜드,유형,제목,언론사,링크,요약
2026-06-18,투썸플레이스,기타 이슈,여름 ‘프리미엄 아이스크림’ 전쟁 시작...벤슨 대적할 ‘밴루엔’ 상...,etoday.co.kr,https://www.etoday.co.kr/news/view/2594595,"17일 외식업계에 따르면 투썸플레이스와 마스터 프랜차이즈 계약(MFA)을 체결한 밴루엔은 7월 3일 강남역 인근에 1호점을 오픈한 뒤 신세계백화점 강남점에 2호점, 신논현역 인근 3호점을 연달아 연다. 1호점은 첫..."
2026-06-18,투썸플레이스,신제품 출시,과일 폭탄 vs 저당 건강식… 올 여름 식품업계 승부수,kmib.co.kr,https://www.kmib.co.kr/article/view.asp?arcid=1781591850&code=14190000&cp=nv,디저트 카페 투썸플레이스도 지난해 350만개의 판매량을 기록한 시그니처 디저트 플랫폼 ‘과일생(과일 생크림 케이크)’의 여름 확장판인 ‘파인생’과 ‘멜론생’을 출시했다. 이번 신제품은 각 과일의 산미와 당도에...
2026-06-18,컴포즈커피,신제품 출시,"컴포즈커피, 음료·푸드·디저트 신메뉴 7종 출시",cstimes.com,https://www.cstimes.com/news/articleView.html?idxno=710287,"컨슈머타임스=안솔지 기자 | 컴포즈커피가 음료와 푸드, 디저트 신메뉴 7종을 출시하며 메뉴 선택 폭 확대에 나섰다. 이번 신메뉴는 간편식 수요 증가와 카페 이용 목적 다변화에 맞춰 기획됐다. 음료는 △꿀 토마토 주스..."
2026-06-18,컴포즈커피,기타 이슈,"""커피 넘어 식사까지""... 컴포즈커피, 메뉴 카테고리 확대",thefirstmedia.net,http://www.thefirstmedia.net/news/articleView.html?idxno=201665,사진=컴포즈커피 저가 커피 브랜드들이 음료 중심 매장에서 벗어나 식사 대용 메뉴와 디저트 강화에 나서고 있다. 커피 소비뿐 아니라 간편식 수요가 늘면서 고객 체류 시간과 객단가를 높이기 위한 메뉴 경쟁도 치열해지는...
2026-06-18,컴포즈커피,기타 이슈,"[1세대 카페, 지금] [이디야] ② 올해 '25주년', 다음 성장 공식은",topdaily.kr,https://www.topdaily.kr/articles/110602,"2010년대 중반 이후 고물가와 소비 침체가 이어지면서 메가MGC커피, 컴포즈커피, 빽다방 등 저가 커피 브랜드가 급성장했다. 이에 따라 과거 이디야가 누렸던 가격 경쟁력 우위도 상당 부분 희석됐다. 업계에서는 스타벅스..."
2026-06-18,컴포즈커피,신제품 출시,‘망고·수박’도 밀렸다…식음료업계 달군 '토마토코어' 열풍,asiatime.co.kr,https://www.asiatime.co.kr/article/20260618500330,컴포즈커피에서 출시한 꿀 토마토주스와 바나프레스의 토마토빙수. (자료=각사) 18일 업계에 따르면 최근 식품·외식업계는 토마토를 활용한 다양한 제품과 메뉴를 선보이며 여름철 소비자 공략에 나서고 있다. 커피...
2026-06-18,컴포즈커피,신제품 출시,"스쿨룩스, '하복 밸런스 게임' 이벤트 진행… 여름 교복 고민 공감 나선...",gokorea.kr,https://www.gokorea.kr/news/articleView.html?idxno=869523,추첨을 통해 선정된 20명에게는 컴포즈커피 딸기 요거트 스무디 기프티콘이 제공될 예정이다. 스쿨룩스는 학생들의 여름철 착용 환경을 고려해 냉감 기능과 활동성을 강화한 하복 제품을 선보이고 있다. 아이스스판 소재를...
2026-06-18,컴포즈커피,신제품 출시,"아모레퍼시픽재단, '장원 인문학자 6기' 수여식 성료…CU, 신규 리워드 ...",sisaon.co.kr,https://www.sisaon.co.kr/news/articleView.html?idxno=201952,"컴포즈커피, 음료·푸드 신메뉴 7종 출시 컴포즈커피는 음료와 푸드, 디저트 등 신메뉴 7종을 출시한다고 18일 밝혔다. 음료 카테고리에서는 국내산 토마토를 꿀과 함께 갈아 만든 '꿀 토마토 주스'와 바나나에 곡물을..."
2026-06-18,컴포즈커피,신제품 출시,"커피만으론 부족했다…컴포즈커피, 메뉴 다각화 승부수",joongangenews.com,https://www.joongangenews.com/news/articleView.html?idxno=526716,"|중앙이코노미뉴스 윤남웅 기자|컴포즈커피, 음료·푸드·디저트 신메뉴 7종 출시. [사진=컴포즈커피]  컴포즈커피가 음료부터 식사 대용 메뉴, 디저트까지 아우르는 신메뉴를 대거 출시하며 메뉴 경쟁력 강화에 나선다. 커피..."
2026-06-18,컴포즈커피,신제품 출시,"컴포즈커피, 음료·푸드·디저트 신제품 7종 선보여",lawissue.co.kr,http://www.lawissue.co.kr/view.php?ud=20260618132117392204ead0791_12,"컴포즈커피가 음료와 푸드, 디저트 카테고리를 확대하며 신메뉴 7종을 출시했다고 18일 밝혔다. 컴포즈커피는 최근 간편식 수요 증가와 소비 패턴 변화에 맞춰 커피 외 메뉴 구성을 강화했다고 설명했다. 이번 신제품은..."
2026-06-18,컴포즈커피,신제품 출시,"컴포즈커피, 음료·푸드·디저트 신메뉴 7종 출시",betanews.net,https://www.betanews.net/article/view/beta202606180065,"컴포즈커피가 음료와 푸드, 디저트 라인업을 강화한 신메뉴 7종을 출시한다고 18일 밝혔다. 이번 신메뉴는 최근 간편식 수요 증가와 다변화된 소비자 라이프스타일을 반영해 기획됐다. 커피 중심의 기존 메뉴 구성에서..."
2026-06-18,컴포즈커피,신제품 출시,"컴포즈커피, 음료·푸드·디저트 신메뉴 7종 대거 출시",news.bbsi.co.kr,https://news.bbsi.co.kr/news/articleView.html?idxno=4089863,"커피 프랜차이즈 컴포즈커피가 다변화된 소비자 라이프스타일을 반영해 음료와 푸드, 디저트 카테고리를 강화한 신메뉴 7종을 출시한다고 오늘 밝혔습니다. 음료 카테고리에서는 국내산 토마토에 꿀을 더한 '꿀 토마토..."
2026-06-18,컴포즈커피,신제품 출시,"""뭐 먹을지 행복한 고민"" 컴포즈커피, 음료·푸드·디저트 라인업 확대",newsis.com,https://www.newsis.com/view/NISX20260618_0003673936,"컴포즈커피가 소비자들의 간편식 수요 증가와 다변화된 라이프스타일을 반영해 음료와 푸드, 디저트 카테고리를 강화한 신메뉴 7종을 출시한다고 18일 밝혔다. 컴포즈커피는 기존 커피 중심 메뉴 구성에서 나아가 음료..."
2026-06-18,컴포즈커피,혜택/프로모션/이벤트,"""여름가전 혜택 키운다"" OK캐쉬백, 삼성전자와 프로모션",newsis.com,https://www.newsis.com/view/NISX20260618_0003673839,"현재 삼성전자와 삼성생명, 컴포즈커피 등 다양한 브랜드가 참여하고 있으며 SK플래닛은 고객 라이프스타일과 소비 트렌드를 반영한 브랜드 협업을 확대할 계획이다. SK플래닛 관계자는 ""오키클럽 플러스 멤버십은..."
2026-06-18,컴포즈커피,신제품 출시,"컴포즈커피, 음료·푸드·디저트 라인업 확대…신메뉴 7종 출시",ppss.kr,https://www.ppss.kr/news/articleView.html?idxno=299130,"컴포즈커피가 음료와 간편식, 디저트 라인업을 한꺼번에 확대하며 카페 이용 수요 공략에 나선다. 컴포즈커피는 18일 주스 2종과 푸드 4종, 디저트 1종 등 신메뉴 총 7종을 출시한다고 밝혔다. 이번 신메뉴는 커피 외에도..."
2026-06-18,컴포즈커피,혜택/프로모션/이벤트,"전자랜드가 게이머에 주목하는 이유, 전자랜드-쿠로게임즈 '명조 Night T...",gamefocus.co.kr,https://gamefocus.co.kr/detail.php?number=176728,"올해 초 ‘띵조 캠퍼스 위크’, ‘명조X컴포즈 커피’, ‘명조X갤럭시 스토어’, ‘띵조 페스티벌’ 등 다양한 오프라인 이벤트를 진행중인 쿠로 게임즈가 용산 전자랜드 4층에 위치한 ‘G:ET PLAY’와의 협업으로..."
2026-06-18,컴포즈커피,신제품 출시,"컴포즈커피, 음료·푸드·디저트 신메뉴 7종 출시",beyondpost.co.kr,http://www.beyondpost.co.kr/view.php?ud=20260618093252473446a9e4dd7f_30,"컴포즈커피는 음료와 푸드, 디저트 메뉴를 강화한 신메뉴 7종을 출시한다고 18일 밝혔다. 이번 신메뉴는 간편식 수요 확대와 소비자 취향 다변화에 맞춰 기획했다. 커피 중심이던 기존 메뉴 구성에서 벗어나 식사 대용..."
2026-06-18,컴포즈커피,혜택/프로모션/이벤트,"SK플래닛, 삼성전자 손잡고 여름가전 할인… 청년 교육사업도 참여",whitepaper.co.kr,http://www.whitepaper.co.kr/news/articleView.html?idxno=263631,"현재 삼성전자와 삼성생명, 컴포즈커피 등이 참여하고 있으며 회원 전용 혜택과 리워드를 제공하고 있다. 권현정 SK플래닛 그룹장은 ""오키클럽 플러스는 고객에게 실질적인 혜택을 제공하고 제휴사에는 고객 접점을..."
2026-06-18,컴포즈커피,신제품 출시,"[신메뉴] 리미니, 여름 한정 메뉴·컴포즈커피, 신메뉴 7종 外",slist.kr,https://www.slist.kr/news/articleView.html?idxno=746033,"사진=컴포즈커피 컴포즈커피가 음료, 푸드, 디저트 카테고리를 강화한 신메뉴 7종을 출시한다. 이번 신메뉴는 간편식 수요 증가와 다변화된 라이프스타일을 반영해 기획됐다. 커피 중심 메뉴 구성에서 음료, 식사 대용..."
2026-06-18,컴포즈커피,신제품 출시,"OK캐쉬백, 회원 프로모션...오아시스마켓, 구독 멤버십",slist.kr,https://www.slist.kr/news/articleView.html?idxno=746024,"지난 5월 출시된 '오키클럽 플러스'는 삼성전자, 삼성생명, 컴포즈커피 등과 협업하며 회원 전용 혜택을 확대하고 있다. 사진=오아시스마켓 오아시스마켓이 온라인 장보기 구독 멤버십 '클럽 오아시스'를 출시했다. 이..."
2026-06-18,컴포즈커피,기타 이슈,소비자원 권고 무시한 일부 커피 프랜차이즈… 영양 성분 공개 여전히 ...,biz.chosun.com,https://biz.chosun.com/distribution/food/2026/06/18/N7TTP7BLTFBNFCWBBZ52L7AGQM/?utm_source=naver&utm_medium=original&utm_campaign=biz,"18일 유통업계에 따르면 한국소비자원은 지난 2022년 전국 200개 이상 매장을 운영하는 커피·음료 프랜차이즈 29곳을 조사해 감성커피, 매머드익스프레스, 셀렉토커피, 쥬씨, 컴포즈커피, 텐퍼센트커피, 하삼동커피 등 7개..."
2026-06-18,폴바셋,신제품 출시,"우리카드, 프리미엄 'the OPUS blue' 출시",businesskorea.co.kr,https://www.businesskorea.co.kr/news/articleView.html?idxno=271581,"이와 함께 블루보틀, 폴바셋, 다이소, 카카오T택시 등 일상에서 자주 이용하는 브랜드에서 1만원 이상 결제할 경우 10% 청구 할인을 제공한다. 전월 실적이나 한도 제한 없이 국내 가맹점 이용 금액의 1%를 기본..."
2026-06-18,테라로사,신제품 출시,"프리즘(PRIZM), '신라모노그램 강릉 레지던스' 여름 휴양 단독 프로모션...",view.asiae.co.kr,https://view.asiae.co.kr/article/2026061814481464884,"여름 성수기를 포함한 투숙 기간의 상품을 프리즘 라이브 단독 특가로 선보이며, 라이브 한정 혜택으로 전 상품 테라로사 음료 2잔 무료 제공과 오션뷰 무료 업그레이드가 가능하다. 여기에 프리즘 단독 혜택으로 각..."
2026-06-18,테라로사,혜택/프로모션/이벤트,"프리즘, '신라모노그램 강릉 레지던스' 단독 프로모션 진행",dailian.co.kr,https://www.dailian.co.kr/news/view/1657234/?sc=Naver,"본방 사수 특전으로 테라로사 음료 2잔과 객실 오션뷰 업그레이드를 무상 지원한다. 추가로 독점 혜택인 각 패키지구매 시 부대시설 크레딧 2만원권, 소인 조식 지원, 소인 수영장 이용권 중 한 가지를 덤으로 선택할 수..."
2026-06-18,테라로사,혜택/프로모션/이벤트,"프리즘, '신라모노그램 강릉 레지던스' 여름 시즌 단독 프로모션 진행",edaily.co.kr,https://www.edaily.co.kr/news/newspath.asp?newsid=04398486645483032,"여름 성수기를 포함한 투숙 기간의 상품을 프리즘 라이브 단독 특가로 제공하며, 라이브 한정 혜택으로 전 상품에 테라로사 음료 2잔 무료 제공과 오션뷰 무료 업그레이드가 가능하다. 또한 프리즘 단독 혜택으로 각..."
2026-06-18,테라로사,신제품 출시,"프리즘, '신라모노그램 강릉 레지던스' 여름 시즌 단독 프로모션 진행",etnews.com,https://www.etnews.com/20260618000100,"여름 성수기를 포함한 투숙 기간의 상품을 프리즘 라이브 단독 특가로 선보이며, 라이브 한정 혜택으로 전 상품 테라로사 음료 2잔 무료 제공과 오션뷰 무료 업그레이드가 가능하다. 여기에 프리즘 단독 혜택으로 각..."
2026-06-18,테라로사,혜택/프로모션/이벤트,[호텔가 이모저모] '신라모노그램 강릉' 여름 프로모션 外,slist.kr,https://www.slist.kr/news/articleView.html?idxno=746057,"라이브 한정 혜택으로 전 상품 테라로사 음료 2잔 무료 제공과 오션뷰 무료 업그레이드가 가능하고, 패키지별로 크레딧 2만원 추가 제공, 소인 조식 무료, 수영장 소인 1인 무료 중 1가지 혜택을 제공한다. 사진=아늑 호텔..."
2026-06-18,블루보틀,신제품 출시,"우리카드, 프리미엄 신상품 'the OPUS blue' 출시",pointdaily.co.kr,https://www.pointdaily.co.kr/news/articleView.html?idxno=308783,"스타벅스 등에 더해 챗GPT, 클로드 등 인공지능(AI) 서비스와 다이소, 블루보틀, 카카오T택시 등에서 1만 원 이상 결제 시 10% 할인을 제공한다. 이용 실적에 따라 제공되는 바우처는 신세계상품권 20만 원권 또는 할인형..."
2026-06-18,블루보틀,혜택/프로모션/이벤트,"[금융권 이모저모]우리은행, 의약품 유통시장에도 '안심 정산' 서비스 가...",businessplus.kr,https://www.businessplus.kr/news/articleView.html?idxno=113052,"또 챗지피티, 클로드, 그록, 다이소, 블루보틀 등 다양한 생활 영역 가맹점에서 할인 혜택을 제공한다. 18일 서울 중구 IBK파이낸스타워에서 열린 'AI Day' 행사에서 참가 직원들이 발표를 하고 있다. / 사진=IBK기업은행..."
2026-06-18,블루보틀,혜택/프로모션/이벤트,"우리카드, 여행·쇼핑 특화 '디오퍼스 블루' 공개…프리미엄 라인업 확...",thefairnews.co.kr,https://www.thefairnews.co.kr/news/articleView.html?idxno=79904,"기존 유튜브, 올리브영, 스타벅스 등에 더해 최근 수요가 급증한 AI 서비스인 챗GPT, 클로드, 그록을 비롯해 다이소, 블루보틀, 카카오T택시, 주요 패밀리 레스토랑 등에서 결제 시 10% 할인 혜택을 제공한다. 바우처..."
2026-06-18,블루보틀,신제품 출시,"[유통소식] 신세계스퀘어, 멕시코전 실시간 중계..축구대표팀 응원전",4th.kr,http://www.4th.kr/news/articleView.html?idxno=2113375,"2026.6.18./사진=롯데마트 보틀벙커, 日 과실 리큐르 '소노만마' 3종 단독 출시 롯데마트는 주류 전문점... 자연주의 유기농 군밤 240g은 6000원대, 매일견과블루베리 20g 23봉은 1만 4000원대에 내놓는다. 초당옥수수와 홍감자..."
2026-06-18,블루보틀,기타 이슈,나인원한남 떠나는 블루보틀…국내 사업 수익성 재편 잰걸음,news1.kr,https://www.news1.kr/industry/distribution/6200312,"블루보틀커피코리아가 국내 진출 초기부터 운영해 온 대표 매장인 한남점의 영업을 종료한다. 임대차 계약 만료가 직접적인 이유지만, 업계에서는 수익성 중심의 점포 효율화 전략이 반영된 것이라는 해석도 나온다. 18일..."
2026-06-18,블루보틀,기타 이슈,"""롯데월드 가던 곳이었는데""..잠실, 어떻게 '동쪽의 명동'이 됐나",fnnews.com,http://www.fnnews.com/news/202606071400551983,"'포터, 휴먼메이드, 블루보틀까지.' 화제성 높은 브랜드를 잇달아 유치한 서울 잠실 롯데월드몰이 MZ세대와 외국인 관광객을 끌어들이며 서울 대표 트렌드 상권으로 떠오르고 있다. 과거 롯데월드와 영화관을 찾는 가족..."
2026-06-17,파스쿠찌,기타 이슈,"15년간 690명 일자리 연계…파리크라상, 식음료 인재 양성 캠프 가동",ekn.kr,https://www.ekn.kr/web/view.php?key=20260617027274154,"수료 후에는 파리바게뜨, 파스쿠찌, 커피앳웍스, 라그릴리아 등 파리크라상 브랜드 매장에 배치돼 근무하게 된다. 지원서는 이달 21일까지 접수하며 서류 심사와 면접 및 실기전형을 거쳐 7월 27일 최종 합격자를..."
2026-06-17,파스쿠찌,기타 이슈,"파리크라상, 채용 연계 교육 프로그램 6기 모집…30명 선발",lawissue.co.kr,http://www.lawissue.co.kr/view.php?ud=202606171645421492204ead0791_12,"선발된 인원은 약 10주간 직무 교육과 현장 실습을 거치게 되며, 수료 이후에는 파리바게뜨, 파스쿠찌 등 계열 매장에서 근무하게 된다. 프로그램은 제빵과 샌드위치 중심 과정, 외식 조리 과정, 음료 제조 과정 등 3개..."
2026-06-17,파스쿠찌,기타 이슈,"파리크라상, 채용연계 교육과정 ‘파리영캠프’ 6기 모집",todayeconomic.com,https://www.todayeconomic.com/news/article.html?no=31011,"수료 후에는 파리바게뜨, 파스쿠찌, 커피앳웍스, 라그릴리아 등 파리크라상 브랜드 매장에서 근무하게 된다. 올 상반기에도 파리영캠프를 통해 15명의 교육생이 수료했으며, 이들은 파리바게뜨와 파스쿠찌 등에 입사할..."
2026-06-17,파스쿠찌,기타 이슈,"파리크라상, 기술 교육·취업 연계 '파리영캠프' 6기 선발",polinews.co.kr,https://www.polinews.co.kr/news/articleView.html?idxno=734311,"선발 인원은 10주 동안 직무 교육과 기술 실습을 이수하게 되며, 수료 후 희망자 전원은 파리바게뜨, 파스쿠찌, 커피앳웍스, 라그릴리아 등 자체 브랜드 매장에 정규직으로 배치된다. 상반기 선발된 5기 교육생 15명도..."
2026-06-17,파스쿠찌,기타 이슈,"파리크라상, 채용 연계 교육 프로그램 '파리영캠프 6기' 모집",newsmap.co.kr,https://www.newsmap.co.kr/news/articleView.html?idxno=757,"수료 후 희망자 전원은 파리바게뜨, 파스쿠찌, 커피앳웍스, 라그릴리아 등 파리크라상이 운영하는 브랜드 매장에서 정직원으로 근무하게 된다. 올 상반기에도 교육생 15명이 과정을 마치고 입사를 앞두고 있다...."
2026-06-17,파스쿠찌,기타 이슈,"파리크라상, '파리영캠프' 6기 모집…매장 채용 연계",metroseoul.co.kr,http://www.metroseoul.co.kr/article/20260617500354,"파리바게뜨, 파스쿠찌, 커피앳웍스, 라그릴리아 등 파리크라상 브랜드 매장에서 근무하게 된다. 올 상반기에도 15명의 교육생이 수료했으며 파리바게뜨, 파스쿠찌 등에 입사할 예정이다. 하반기 진행하는 파리영캠프..."
2026-06-17,파스쿠찌,기타 이슈,"유통·물류업계, 청년 채용연계 프로그램 확대…인재 발굴",cnbizm.com,https://www.cnbizm.com/news/articleView.html?idxno=305794,"수료 후에는 파리바게뜨, 파스쿠찌, 커피앳웍스, 라그릴리아 등 파리크라상 브랜드 매장에서 근무하게 된다. 올 상반기에도 15명의 교육생이 수료해 파리바게뜨, 파스쿠찌 등에 입사할 예정이다. 하반기 진행하는..."
2026-06-17,파스쿠찌,기타 이슈,청년 정규직 채용 늘리는 파리크라상...'파리영캠프' 6기 모집,job-post.co.kr,https://www.job-post.co.kr/news/articleView.html?idxno=218488,"수료 후에는 파리바게뜨, 파스쿠찌, 커피앳웍스 등 파리크라상 브랜드 매장에서 근무할 수 있다. 하반기 진행하는 파리영캠프 6기 모집 인원은 총 30명으로 지원 접수는 이달 21일까지다. 최종 합격자 발표는 내달 27일이며..."
2026-06-17,파스쿠찌,기타 이슈,"쿠팡CFS·파리크라상, 청년 채용연계 프로그램 확대… ""일자리와 실무경...",newsian.co.kr,http://www.newsian.co.kr/news/articleView.html?idxno=91071,"선발된 교육생들은 10주간 직장생활 기본 교육과 전문 기술 교육, 현장 실습 및 견학 과정을 거친 뒤 파리바게뜨, 파스쿠찌, 커피앳웍스, 라그릴리아 등 파리크라상 브랜드 매장에서 근무하게 된다. 하반기 진행되는 6기..."
2026-06-17,파스쿠찌,기타 이슈,"채용 연계형 교육 프로그램 확대... 파리크라상, 청년 인재 양성 '파리영...",thefirstmedia.net,http://www.thefirstmedia.net/news/articleView.html?idxno=201560,"선발된 교육생들은 10주간 직장 생활 기본 교육과 전문 기술 교육, 현장 실습 및 견학 등을 이수하며, 수료 후 희망자 전원은 파리크라상 정규직으로 채용돼 파리바게뜨, 파스쿠찌, 커피앳웍스, 라그릴리아 등 브랜드..."
2026-06-17,파스쿠찌,기타 이슈,"파리크라상, 청년 인재 육성 나선다…'파리영캠프' 6기 모집",seoultimes.news,https://www.seoultimes.news/news/article.html?no=2000096734,"제과·제빵·조리·바리스타 교육 제공…청년 인재 육성 수료 후 파리바게뜨·파스쿠찌 등 브랜드 매장 채용... 수료 후 희망자를 대상으로 파리바게뜨와 파스쿠찌, 커피앳웍스, 라그릴리아 등 파리크라상 정규직 채용이..."
2026-06-17,파스쿠찌,기타 이슈,"파리크라상, '파리영캠프' 6기 모집",businesskorea.co.kr,https://www.businesskorea.co.kr/news/articleView.html?idxno=271476,"교육 과정에는 현장 실습과 견학이 포함되며, 수료 후에는 파리바게뜨와 파스쿠찌, 라그릴리아 등 주요 브랜드 매장에서 근무를 시작할 예정이다. 이번 프로그램은 단순한 단기 일자리 제공이 아닌 전문 직업인 양성에..."
2026-06-17,파스쿠찌,기타 이슈,"청년 인재 양성, 교육·현장 실무 연계 등 경력 설계 방식 다양화",onews.tv,https://www.onews.tv/news/articleView.html?idxno=281642,"수료 후에는 파리바게뜨, 파스쿠찌, 커피앳웍스, 라그릴리아 등 파리크라상 브랜드 매장에서 근무하게... 올해 상반기에도 15명의 교육생이 수료해 파리바게뜨와 파스쿠찌 등에 입사할 예정이다. 고양산업진흥원..."
2026-06-17,파스쿠찌,기타 이슈,"[유통레이더] 이마트 에브리데이, 닥터지, 파리크라상, BBQ, KT&G, 일동후...",daily.hankooki.com,https://daily.hankooki.com/news/articleView.html?idxno=1377243,"교육생들은 10주간 직무 교육과 현장 실습을 거친 뒤 파리바게뜨, 파스쿠찌, 커피앳웍스, 라그릴리아 등에서 근무하게 된다. 지원서는 오는 21일까지 접수하며 최종 합격자는 다음달 27일 발표된다. 사진=제너시스BBQ..."
2026-06-17,파스쿠찌,기타 이슈,"파리크라상, 채용연계 교육 프로그램 '파리영캠프' 6기 모집",sports.hankooki.com,https://sports.hankooki.com/news/articleView.html?idxno=6934774,"수료 후에는 파리바게뜨와 파스쿠찌, 커피앳웍스, 라그릴리아 등 파리크라상 브랜드 매장에 배치된다. 회사 측에 따르면 올해 상반기 교육생 15명도 수료 후 계열 브랜드에 입사할 예정이다. 하반기 진행되는 6기 모집..."
2026-06-17,파스쿠찌,기타 이슈,"10주 교육 뒤 정직원 채용…파리크라상, '파리영캠프' 6기 모집",news.tvchosun.com,https://news.tvchosun.com/site/data/html_dir/2026/06/17/2026061790127.html,"수료 후에는 파리바게뜨, 파스쿠찌, 커피앳웍스, 라그릴리아 등 파리크라상 브랜드 매장에서 근무하게 된다. 올해 상반기에도 교육생 15명이 파리영캠프를 수료해 파리바게뜨와 파스쿠찌 등에 입사할 예정이다...."
2026-06-17,파스쿠찌,기타 이슈,[잘먹잘살+]LG생건·배민·유한킴벌리·파리크라상·KT&G,businessplus.kr,https://www.businessplus.kr/news/articleView.html?idxno=112977,"파리바게뜨, 파스쿠찌, 커피앳웍스, 라그릴리아 등 파리크라상 브랜드 매장에서 근무하게 된다. 올 상반기에도 15명의 교육생이 수료해 파리바게뜨, 파스쿠찌 등에 입사할 예정이다. 하반기 진행하는 파리영캠프 6기의..."
2026-06-17,파스쿠찌,기타 이슈,"""청년의 꿈, 노릇하게 구워낸다"" 파리크라상, '파리영캠프' 6기 모집",newsis.com,https://www.newsis.com/view/NISX20260617_0003672309,"수료 후에는 파리바게뜨, 파스쿠찌, 커피앳웍스, 라그릴리아 등 파리크라상 브랜드 매장에서 근무할 수 있다. 하반기 진행하는 파리영캠프 6기 모집 인원은 총 30명으로 지원 접수는 21일까지다. 최종 합격자 발표는..."
2026-06-17,파스쿠찌,기타 이슈,"파리크라상, 채용 연계 교육 '파리영 캠프' 6기 모집",foodnews.co.kr,http://www.foodnews.co.kr/news/articleView.html?idxno=119003,"수료 후에는 파리바게뜨, 파스쿠찌, 커피앳웍스, 라그릴리아 등 파리크라상 브랜드 매장에서 근무한다. 6기 모집 인원은 30명으로, 지원서는 21일까지 제출하면 된다. 파리크라상은 서류 심사와 면접, 실기전형을 거쳐..."
