일자,브랜드,유형,제목,언론사,링크,요약
2026-05-17,할리스,기타 이슈,"KB금융, 원화 스테이블코인 기술 검증 완료로 디지털 금융 혁신 가속화",tokenpost.kr,https://www.tokenpost.kr/news/cryptocurrency/360506,"실제 생활 결제 사례로는 커피전문점 할리스의 오프라인 키오스크 결제가 적용됐다. 소비자가 별도의 디지털 지갑을 설치하지 않고 큐알 방식으로 결제하면, 뒤에서 블록체인 스마트 계약이 자동으로 작동해 정산이..."
2026-05-17,할리스,기타 이슈,"KB금융, 원화 스테이블코인 기반 결제·정산·해외송금 기술 검증 완료",delighti.co.kr,https://www.delighti.co.kr/news/articleView.html?idxno=116492,"실생활 결제 모델은 커피전문점 할리스(Hollys)의 오프라인 키오스크를 통해 구현됐다. 소비자는 별도의 디지털 지갑 설치 없이 QR코드를 통해 결제할 수 있으며, 정산 단계에서는 블록체인 스마트 컨트랙트가 자동..."
2026-05-17,할리스,기타 이슈,방한 외국인 역대 최대… ‘K-카페’가 뜬다,viva100.com,https://www.viva100.com/article/20260515500377,할리스는 송도에 인천한옥마을점을 오픈했다. 한옥의 기와지붕과 목조 구조를 활용해 한국적인 미감을 강조하면서도 개방감 있는 내부 공간을 조성해 체류형 매장 경쟁력을 높였다. 테라로사 역시 경주 매장에서 한옥...
2026-05-17,할리스,기타 이슈,"베트남 송금 3분 컷… KB금융그룹, '원화 스테이블코인' 기술 실증 완료",financialpost.co.kr,https://www.financialpost.co.kr/news/articleView.html?idxno=259379,실제 결제 환경은 커피 전문점 할리스 키오스크에 적용됐다. 디지털 지갑 앱을 따로 설치하지 않아도 QR 코드로 스캔만 하면 스마트 컨트랙트 기술을 통해 자동으로 돈이 정산된다. 해외 송금 분야에서는 카이아의 온체인...
2026-05-17,할리스,기타 이슈,"KB금융, 원화 스테이블코인 결제·정산·해외송금 기술 검증",wolyo.co.kr,https://www.wolyo.co.kr/news/articleView.html?idxno=312276,"실생활 결제 모델은 커피전문점 할리스(Hollys)의 오프라인 키오스크 결제를 통해 구현됐다. 소비자가 별도의 디지털 지갑 설치 없이 QR을 통해 결제하면, 정산 단계에서 블록체인 스마트 컨트랙트가 자동으로 실행된다...."
2026-05-17,할리스,기타 이슈,"KB금융, 원화 스테이블코인 결제·해외송금 전 과정 기술 검증 완료",etnews.com,https://www.etnews.com/20260517000065,오프라인 결제는 커피전문점 할리스 매장에서 QR코드를 통해 구현됐다. 소비자가 결제하면 블록체인 스마트 계약(스마트 컨트랙트)이 자동 실행돼 가맹점 정산까지 처리되는 구조다. 해외송금은 원화 스테이블코인을...
2026-05-17,할리스,기타 이슈,"KB금융, 국내 최초 원화 스테이블코인 금융서비스 통합 검증 성공",news.bbsi.co.kr,https://news.bbsi.co.kr/news/articleView.html?idxno=4084086,이번 검증은 할리스커피 매장의 오프라인 키오스크 결제를 통해 실생활 적용 가능성을 확인했습니다. 소비자가 QR코드로 결제하면 블록체인 기술이 자동으로 정산을 처리하는 방식입니다. 특히 해외 송금 검증에서는...
2026-05-17,할리스,기타 이슈,"KB금융, 원화 스테이블코인 기반 '결제·정산·해외송금' 기술 검증 완료",joongangenews.com,https://www.joongangenews.com/news/articleView.html?idxno=519808,"실생활 결제 모델은 커피전문점 할리스(Hollys)의 오프라인 키오스크 결제를 통해 구현됐다. 소비자가 별도의 디지털 지갑 설치 없이 QR을 통해 결제하면, 정산 단계에서 블록체인 스마트 컨트랙트가 자동으로 실행되는..."
2026-05-17,할리스,기타 이슈,"KB금융, 원화 스테이블코인 기반 '결제·정산·해외송금' 전 과정 기술 ...",worktoday.co.kr,http://www.worktoday.co.kr/news/articleView.html?idxno=84670,"실제 결제는 커피전문점 할리스(Hollys)의 오프라인 키오스크에서 구현됐다. 소비자가 별도의 디지털 지갑을 설치하지 않고 QR을 통해 결제하면, 정산 단계에서 블록체인 스마트컨트랙트가 자동 실행되는 방식이다...."
2026-05-17,할리스,기타 이슈,"KB금융그룹, 원화 스테이블코인 모든 단계 통합 기술검증 마무리",newspim.com,https://www.newspim.com/news/view/20260517000041,"실생활 결제 모델은 커피전문점 할리스(Hollys)의 오프라인 키오스크 결제를 통해 구현됐다. 소비자가 별도의 디지털 지갑 설치 없이 QR코드를 통해 결제하면, 블록체인 스마트 컨트랙트가 자동으로 실행되는 구조이다...."
2026-05-17,할리스,기타 이슈,"KB금융, 원화 스테이블코인 실증 성공...결제·정산·해외송금 망라",newsroad.co.kr,http://www.newsroad.co.kr/news/articleView.html?idxno=59408,"실생활 결제 모델은 커피전문점 할리스(Hollys)의 오프라인 키오스크 결제를 통해 구현됐다. 소비자가 별도의 디지털 지갑 설치 없이 QR을 통해 결제하면, 정산 단계에서 블록체인 스마트 컨트랙트가 자동으로 실행되는..."
2026-05-17,할리스,기타 이슈,"KB금융, 원화 스테이블코인 결제·정산·입금 기술검증 성공",edaily.co.kr,http://www.edaily.co.kr/news/newspath.asp?newsid=01561286645449904,실생활 결제 모델은 커피전문점 할리스(Hollys)의 오프라인 키오스크 결제를 통해 구현했다. 소비자가 별도의 디지털 지갑 설치 없이 QR을 통해 결제하면 정산 단계에서 블록체인 스마트 컨트랙트가 자동으로 실행되는...
2026-05-17,할리스,기타 이슈,"KB금융, 스테이블코인 기반 결제·송금 기술 검증 완료…“3분 내 해외송...",socialvalue.kr,https://www.socialvalue.kr/news/view/1065578556625774,실생활 결제 모델은 커피전문점 할리스 오프라인 키오스크를 통해 구현됐다. 소비자가 별도의 디지털 지갑 설치 없이 QR로 결제하면 블록체인 스마트 컨트랙트가 자동으로 정산을 처리하는 구조다. 해외송금 검증에서는...
2026-05-17,할리스,기타 이슈,"KB금융, 원화 스테이블코인 결제·정산·송금 기술 검증 완료",news1.kr,https://www.news1.kr/finance/bank/6169066,오프라인 결제는 커피전문점 할리스 키오스크를 통해 진행됐다. 이용자가 QR코드로 결제하면 블록체인 기반 스마트컨트랙트가 자동으로 정산을 처리하는 방식이다. 별도의 디지털 지갑 설치 없이 기존 결제 방식과...
2026-05-17,할리스,기타 이슈,"KB금융, 원화코인 결제·정산·해외송금 전과정 기술 검증",newsis.com,https://www.newsis.com/view/NISX20260517_0003632694,"실생활 결제 모델의 경우 커피전문점 '할리스'의 오프라인 키오스크 결제를 통해 구현됐다. 소비자는 디지털 지갑이 없이도 QR을 통해 결제할 수 있고, 정산 단계에서 블록체인 스마트 컨트랙트가 자동 실행된다...."
2026-05-17,할리스,기타 이슈,"KB금융, 스테이블코인 송금 ‘3분’ 검증 완료",ddaily.co.kr,https://www.ddaily.co.kr/page/view/2026051710370845423,실생활 결제 모델은 커피전문점 할리스 오프라인 키오스크에서 구현됐다. 소비자가 별도 디지털 지갑을 설치하지 않고 QR로 결제하면 정산 단계에서 블록체인 스마트 컨트랙트가 자동 실행되는 방식이다. 해외송금...
2026-05-17,할리스,기타 이슈,"KB금융, 원화 스테이블코인 '결제·송금' 통합검증 성공…""실생활 금융...",newsworks.co.kr,https://www.newsworks.co.kr/news/articleView.html?idxno=841011,실생활 결제 모델은 대형 커피전문점인 할리스의 오프라인 키오스크 환경에서 성공적으로 구현됐다. 가장 큰 특징은 '대중성'이다. 소비자는 블록체인 서비스를 이용할 때 필수적으로 요구되던 별도의 디지털 지갑을...
2026-05-17,할리스,기타 이슈,"KB금융, 원화 스테이블코인 기반 '결제·정산·해외송금' 기술검증",ebn.co.kr,https://www.ebn.co.kr/news/articleView.html?idxno=1709073,"실생활 결제 모델은 커피전문점 할리스(Hollys)의 오프라인 키오스크 결제를 통해 구현됐다. 소비자가 별도의 디지털 지갑 설치 없이 QR을 통해 결제하면, 정산 단계에서 블록체인 스마트 컨트랙트가 자동으로 실행되는..."
2026-05-17,할리스,기타 이슈,"KB금융, 발행부터 송금까지 직접 설계…스테이블코인 결제·송금 검증 완...",digitaltoday.co.kr,https://www.digitaltoday.co.kr/news/articleView.html?idxno=666546,실생활 결제 모델은 커피전문점 할리스 오프라인 키오스크를 통해 구현됐다. 소비자가 별도의 디지털 지갑 설치 없이 QR로 결제하면 블록체인 스마트 컨트랙트가 자동 실행돼 정산이 이뤄지는 방식이다. 해외송금...
2026-05-17,할리스,기타 이슈,"‘3분 안에 코인 송금’…KB금융, 원화 스테이블코인 기술검증 마무리",hankyung.com,https://www.hankyung.com/article/202605171359i,실생활 결제 모델은 커피전문점 할리스(Hollys)의 오프라인 키오스크 결제로 구현했다. 이용자가 디지털 지갑을 별도로 설치하지 않고도 QR 결제를 하면 정산 단계에서 블록체인 스마트 컨트랙트가 자동으로 실행된다....
2026-05-17,할리스,기타 이슈,"KB금융, 원화 스테이블코인 결제·정산·입금 기술 검증 완료",biz.chosun.com,https://biz.chosun.com/stock/finance/2026/05/17/CIEZ4JIZJRDLDLUGZZCJ3I5AUE/?utm_source=naver&utm_medium=original&utm_campaign=biz,실생활 결제 모델은 커피전문점 할리스의 오프라인 키오스크 결제를 통해 구현됐다. 소비자가 별도 디지털 지갑을 설치하지 않고 QR(Quick Response)로 결제하면 정산 단계에서 블록체인 스마트 컨트랙트(Smart...
2026-05-17,할리스,기타 이슈,"KB금융, 원화 스테이블코인 실증 성공…결제부터 해외송금까지 구현",view.asiae.co.kr,https://view.asiae.co.kr/article/2026051710140051710,"실생활 결제 모델은 커피전문점 할리스의 오프라인 키오스크 환경에서 구현됐다. 소비자는 별도의 디지털 지갑을 설치하지 않고 큐알(QR)을 통해 결제를 진행할 수 있으며, 결제 이후 정산 단계에서는 블록체인 기반..."
2026-05-17,할리스,기타 이슈,"KB금융, 원화 스테이블코인 금융 '기술 검증' 마쳐",straightnews.co.kr,https://www.straightnews.co.kr/news/articleView.html?idxno=302644,실생활 결제 모델은 KG이니시스의 관계사가 운영하는 커피전문점 할리스(Hollys)의 오프라인 키오스크 결제를 통해 구현됐다. 통상 결제에 필요한 디지털 지갑 설치 없이도 QR을 통해 결제를 시도하면 정산 단계에서...
2026-05-17,할리스,기타 이슈,"""외산 플랫폼 의존 낮춘다""…금융, 원화 스테이블코인 선점 경쟁",4th.kr,http://www.4th.kr/news/articleView.html?idxno=2111871,검증 과정에서는 커피전문점 할리스 오프라인 키오스크에서 소비자가 별도 디지털 지갑 없이 QR코드로 결제하면 블록체인 스마트계약을 통해 가맹점 대금이 자동 정산되는 모델이 구현됐다. 해외송금 부문에서는 기존...
2026-05-17,할리스,기타 이슈,"KB금융, 원화 스테이블코인 기술 검증 완료",businesskorea.co.kr,https://www.businesskorea.co.kr/news/articleView.html?idxno=269550,"실생활 결제 모델은 커피전문점 할리스의 오프라인 키오스크를 통해 구현됐다. 소비자가 별도의 디지털 지갑을 설치할 필요 없이 기존 방식대로 QR 코드를 스캔해 결제하면, 블록체인의 스마트 컨트랙트 기술이 작동해..."
2026-05-17,할리스,기타 이슈,“QR 찍었더니 베트남 송금까지 3분” … KB금융 스테이블코인 해외송금...,biz.newdaily.co.kr,https://biz.newdaily.co.kr/site/data/html/2026/05/17/2026051700018.html,"실제 테스트는 커피전문점 할리스(Hollys) 오프라인 키오스크에서 진행됐다. 소비자는 별도 디지털 지갑 설치 없이 QR 결제를 이용할 수 있으며, 결제 이후 정산 과정에서는 블록체인 스마트컨트랙트가 자동 실행되는..."
2026-05-17,할리스,기타 이슈,"KB금융, 스테이블코인 실생활 결제 검증…해외송금 3분 내 완료",dt.co.kr,https://www.dt.co.kr/article/12062718?ref=naver,실생활 결제 모델은 커피전문점 할리스의 오프라인 키오스크 결제를 통해 구현됐다. 소비자가 별도 디지털 지갑을 설치하지 않고 QR로 결제하면 정산 단계에서 블록체인 스마트 컨트랙트가 자동으로 실행되는 구조다....
2026-05-17,할리스,기타 이슈,"[토큰주식] KB금융, 원화코인 결제·정산·해외송금 기술검증 완료",tokenpost.kr,https://www.tokenpost.kr/news/economy/360474,"오프라인 결제는 할리스 키오스크 QR 결제로 구현했고, 가맹점 정산 단계에서는 스마트계약이 자동 실행되도록 설계했다. 해외송금은 원화 스테이블코인을 온체인 유동성을 통해 달러 스테이블코인으로 바꾼 뒤..."
2026-05-17,할리스,기타 이슈,"KB금융, 원화 스테이블코인 활용 결제·정산·해외송금 기술 검증 성공",ziksir.com,https://www.ziksir.com/news/articleView.html?idxno=134091,"실생활 결제 모델은 커피전문점 할리스(Hollys) 오프라인 키오스크를 통해 구현됐다. 소비자는 별도의 디지털 지갑 설치 없이 QR 방식으로 결제할 수 있으며, 이후 정산 단계에서는 블록체인 스마트 컨트랙트가 자동으로..."
2026-05-17,할리스,기타 이슈,"KB금융, 원화 스테이블코인 '결제·정산·해외송금' 기술검증 완료",thetracker.co.kr,https://thetracker.co.kr/View.aspx?No=4080547,"실생활 결제 모델은 커피전문점 할리스의 오프라인 키오스크 결제를 통해 구현됐다. 소비자가 별도의 디지털 지갑 설치 없이 QR을 통해 결제하면, 정산 단계에서 블록체인 스마트 컨트랙트가 자동으로 실행되는 구조다...."
2026-05-17,할리스,기타 이슈,"KB금융, 원화코인 결제·정산·해외송금 기술검증 완료",yna.co.kr,https://www.yna.co.kr/view/AKR20260515052900002?input=1195m,"실생활 결제 모델은 커피전문점 할리스(Hollys)의 오프라인 키오스크 결제를 통해 구현했다. 소비자가 디지털 지갑 설치 없이 QR로 결제하면, 정산 단계에서 블록체인 스마트 계약이 자동 실행되는 구조다. 아울러..."
2026-05-17,할리스,기타 이슈,토마토와 MZ는 겉·속이 같아 '솔직함'으로 통한다? 그건 알 수 없지만 ...,huffingtonpost.kr,https://www.huffingtonpost.kr/article/257194,할리스도 여름 시즌 컵빙수 메뉴에 토마토를 활용했다. ‘토마토 상큼 컵빙수’는 토마토 과육과 우유 얼음을 조합해 새콤하면서도 달콤한 맛을 강조했다. 일반적 팥빙수와 차별화한 비주얼 덕분에 SNS 인증 콘텐츠로도...
2026-05-17,블루보틀,신제품 출시,"5월부터 여름 장사 시작…유통업계, 빙수·대용량 음료 앞당겼다",segye.com,https://www.segye.com/newsView/20260517502138?OutUrl=naver,네스프레소는 블루보틀 커피와 협업한 한정판 머신 ‘버츄오 팝+ 블루보틀 커피 리미티드 에디션’을 재출시했다. 지난해 여름 출시 당시 2주 만에 완판됐던 제품이다. 아이스와 라테 모드를 지원해 얼음이나 우유를 더한...
2026-05-16,할리스,신제품 출시,제철 맞은 ‘이 채소’로 젤리·음료·빙수까지…유통가 휩쓴 ‘토마토...,mk.co.kr,https://www.mk.co.kr/article/12049993,할리스는 여름 신메뉴로 컵빙수 제품군을 확대했다. 이 가운데 ‘토마토 상큼 컵빙수’는 토마토 과육과 우유 얼음을 조합해 색다른 맛을 구현한 제품이다. 저가 커피 브랜드 바나프레소는 생토마토를 활용한 눈꽃빙수...
2026-05-16,할리스,혜택/프로모션/이벤트,"KT, 고물가 시대 고객 부담 덜어준다… 5월 '달달혜택' 프로모션 전개",thepublic.kr,https://www.thepublic.kr/news/articleView.html?idxno=304532,"대형 마트인 롯데마트 제타를 비롯해 할리스, 폴바셋, 파리바게뜨, 쉐이크쉑, 도미노피자 등 유명 외식 프랜차이즈에서 결제 시 혜택을 지원한다. 가족 나들이객을 위해 플레이타임, 추억의 국민학교 떡볶이 등 맞춤형..."
2026-05-16,할리스,신제품 출시,토마토맛 마이쮸까지 나왔다…저속노화 열풍에 식품업계 ‘빨간 승부’,segye.com,https://www.segye.com/newsView/20260516502509?OutUrl=naver,할리스는 여름 시즌 메뉴로 ‘토마토 상큼 컵빙수’를 선보였다. 토마토 과육을 올리고 우유 얼음과 조합한 1인용 컵빙수다. 망고나 팥 중심이던 빙수 시장에서 토마토를 전면에 내세운 점이 눈에 띈다. 파라다이스...
2026-05-16,할리스,혜택/프로모션/이벤트,"[통신리뷰] LG유플러스, AI 비서 '익시오' SaaS형 수출 첫발(5월2주차)",theguru.co.kr,https://www.theguru.co.kr/news/article.html?no=101848,"달달혜택은 5월 15일부터 31일까지 운영되며, 롯데마트 제타 최대 50% 할인, 할리스·폴바셋 커피 50% 할인, 파리바게뜨·쉐이크쉑·도미노피자 할인 등 일상에서 활용도 높은 외식·쇼핑 혜택을 제공한다. 이와 함께..."
2026-05-16,폴바셋,신제품 출시,"말차, 피스타치오를 뒤이은 보라색 식재료 대란",wkorea.com,https://www.wkorea.com/2026/05/16/%eb%a7%90%ec%b0%a8-%ed%94%bc%ec%8a%a4%ed%83%80%ec%b9%98%eb%a5%bc-%eb%92%a4%ec%9d%b4%ec%9d%80-%eb%b3%b4%eb%9d%bc%ec%83%89-%ec%8b%9d%ec%9e%ac%eb%a3%8c-%eb%8c%80%eb%9e%80/?utm_source=naver&utm_medium=partnership,"스타벅스, 폴바셋,투썸 플레이스 등 대형 카페 브랜드들은 아이스 라떼나 스무디에 우베 파우더 한 스쿱을 더해 비주얼과 영양을 동시에 챙기는 신메뉴들을 출시하고 있고요. 편의점 업계도 보랏빛으로 물들여지는..."
2026-05-15,할리스,혜택/프로모션/이벤트,"KT멤버십, 5월 외식·쇼핑·문화 혜택 확대...배민·투썸 중 선택",womentimes.co.kr,https://www.womentimes.co.kr/news/articleView.html?idxno=103016,"롯데마트 제타 최대 50% 할인, 할리스·폴바셋 커피 50% 할인, 파리바게뜨·쉐이크쉑·도미노피자 할인 등 일상 소비와 연결된 혜택이 포함됐다. 플레이타임, 추억의 국민학교 떡볶이 등 가족 단위 고객을 겨냥한 혜택도..."
2026-05-15,할리스,혜택/프로모션/이벤트,"KT, 가족과 즐기는 5월 멤버십 혜택 공개",ekoreanews.co.kr,https://www.ekoreanews.co.kr/news/articleView.html?idxno=86070,"달달혜택은 5월 15일부터 31일까지 운영되며, 롯데마트 제타 최대 50% 할인, 할리스·폴바셋 커피 50% 할인, 파리바게뜨·쉐이크쉑·도미노피자 할인 등 일상에서 활용도 높은 외식·쇼핑 혜택을 제공한다. 이와 함께..."
2026-05-15,폴바셋,혜택/프로모션/이벤트,[#통신 풍향계] SKT-국방부 '국방 AI 전환' 협약·LGU+ '갤럭시 버디5' 출...,newsworks.co.kr,https://www.newsworks.co.kr/news/articleView.html?idxno=840911,"15일부터 31일까지 운영하는 달달혜택은 롯데마트 제타 최대 50% 할인, 할리스·폴바셋 커피 50% 할인, 파리바게뜨·쉐이크쉑·도미노피자 할인 등을 제공한다. 컬리·GS SHOP·크록스·롯데렌터카·신라면세점 할인..."
2026-05-15,폴바셋,혜택/프로모션/이벤트,[ICT 종합] 크로쓰 및 IPX 소식 외,gamevu.co.kr,https://www.gamevu.co.kr/news/articleView.html?idxno=57932,"달달혜택은 5월 15일부터 31일까지 운영되며, 롯데마트 제타 최대 50% 할인, 할리스·폴바셋 커피 50% 할인, 파리바게뜨·쉐이크쉑·도미노피자 할인 등 일상에서 활용도 높은 외식·쇼핑 혜택을 제공한다. 이와 함께..."
2026-05-15,폴바셋,혜택/프로모션/이벤트,"KT, 5월 멤버십 혜택 운영",lcnews.co.kr,https://www.lcnews.co.kr/news/articleView.html?idxno=202200,"5월 15일부터 31일까지 운영되는 달달혜택은 롯데마트 제타 최대 50% 할인, 할리스·폴바셋 커피 50% 할인 등을 제공한다. 컬리·GS SHOP·크록스·롯데렌터카·신라면세점 할인, 마이리얼트립 여행 혜택, 아쿠아필드..."
2026-05-15,폴바셋,혜택/프로모션/이벤트,"KT, 가족과 즐기는 5월 멤버십 혜택 공개",betanews.net,https://www.betanews.net/article/view/beta202605150044,"롯데마트 제타 최대 50% 할인, 할리스·폴바셋 커피 50% 할인, 파리바게뜨·쉐이크쉑·도미노피자 할인 등 외식·쇼핑 혜택을 제공한다. 플레이타임, 추억의 국민학교 떡볶이 등 가족 단위 혜택도 마련됐으며, 컬리·GS..."
2026-05-15,폴바셋,혜택/프로모션/이벤트,"KT·LG유플러스, 5월 고객 확보 경쟁 확대...멤버십 혜택·중저가 단말 ...",popcornnews.net,http://www.popcornnews.net/news/articleView.html?idxno=121457,"이와 함께 달달혜택에서는 롯데마트 제타 최대 50% 할인, 할리스·폴바셋 커피 50% 할인, 파리바게뜨·쉐이크쉑·도미노피자 할인 등을 제공한다. 플레이타임과 추억의 국민학교 떡볶이 등 가족 단위 고객 대상 혜택도..."
2026-05-15,폴바셋,혜택/프로모션/이벤트,"[Telecom & Now] KT, '투썸 50% 할인' 등 5월 멤버십 혜택 공개 등",ebn.co.kr,https://www.ebn.co.kr/news/articleView.html?idxno=1708952,"롯데마트 제타 최대 50% 할인, 할리스·폴바셋 커피 50% 할인, 파리바게뜨·쉐이크쉑·도미노피자 할인 등 일상에서 활용도 높은 외식·쇼핑 혜택을 제공한다. 또한 컬리·GS SHOP·크록스·롯데렌터카·신라면세점 할인..."
2026-05-15,폴바셋,혜택/프로모션/이벤트,"KT, 5월 가정의 달 맞아 멤버십 ‘달달혜택’ 강화",breaknews.com,http://www.breaknews.com/1207371,"롯데마트 제타 최대 50% 할인, 할리스·폴바셋 커피 50% 할인, 파리바게뜨·쉐이크쉑·도미노피자 할인 등이 진행된다. 또한, 컬리·GS SHOP·크록스·롯데렌터카..."
2026-05-15,폴바셋,혜택/프로모션/이벤트,"투썸 반값·배민 8000원 할인...KT, 브랜드별 5월 혜택 총정리",gukjenews.com,https://www.gukjenews.com/news/articleView.html?idxno=3583127,"달달혜택은 15일부터 31일까지 운영되며, 롯데마트 제타 최대 50% 할인, 할리스·폴바셋 커피 50% 할인, 파리바게뜨·쉐이크쉑·도미노피자 할인 등 일상에서 활용도 높은 외식·쇼핑 혜택을 제공한다. 또 컬리·GS SHOP..."
2026-05-15,폴바셋,혜택/프로모션/이벤트,"KT, 마트·카페 50% 할인 멤버십 혜택",biz.heraldcorp.com,https://biz.heraldcorp.com/article/10738746?ref=naver,"▷롯데마트 제타 최대 50% 할인 ▷할리스·폴바셋 커피 50% 할인 ▷파리바게뜨·쉐이크쉑·도미노피자 할인 등 일상에서 활용도 높은 외식·쇼핑 혜택을 제공한다. 아울러 플레이타임, 추억의 국민학교 떡볶이 등 가족..."
2026-05-15,폴바셋,혜택/프로모션/이벤트,"KT, '투썸' 반값 등 5월 멤버십 이벤트 공개",zdnet.co.kr,https://zdnet.co.kr/view/?no=20260515105301,"달달혜택은 이날부터 31일까지 운영되며, 롯데마트 제타 최대 50% 할인, 할리스, 폴바셋 커피 50% 할인, 파리바게뜨, 쉐이크쉑, 도미노피자 할인 등을 제공한다. 플레이타임, 추억의 국민학교 떡볶이 등 가족 단위..."
2026-05-15,폴바셋,혜택/프로모션/이벤트,"KT, '가정의 달' 5월 멤버십 공개…'외식·문화' 60% 할인",shinailbo.co.kr,https://www.shinailbo.co.kr/news/articleView.html?idxno=5021127,"롯데마트 제타 최대 50% 할인, 할리스·폴바셋 커피 50% 할인, 파리바게뜨·쉐이크쉑·도미노피자 할인 등 외식·쇼핑 관련 혜택이 제공된다. 플레이타임, 추억의 국민학교 떡볶이 등 가족 단위 고객을 위한 혜택도..."
2026-05-15,폴바셋,혜택/프로모션/이벤트,"배민·투썸 할인…KT, 5월 고객 보답 프로그램 공개",digitaltoday.co.kr,https://www.digitaltoday.co.kr/news/articleView.html?idxno=666047,"롯데마트 제타 최대 50% 할인, 할리스·폴바셋 커피 50% 할인, 파리바게뜨·쉐이크쉑·도미노피자 할인 등 일상에서 활용도가 큰 혜택을 제공한다. 문화 혜택도 있다. KT멤버십 고객은 뮤지컬 '빌리 엘리어트' 등 공연을..."
2026-05-15,폴바셋,혜택/프로모션/이벤트,"KT, 5월 멤버십 혜택 강화…외식·쇼핑·여가 등 최대 55% 할인",swtvnews.com,https://swtvnews.com/news/newsview.php?ncode=1065575255371302,"달달혜택은 15~31일 롯데마트 제타 최대 50% 할인, 할리스·폴바셋 커피 50% 할인, 파리바게뜨·쉐이크쉑·도미노피자 할인 등 외식·쇼핑 혜택을 제공한다. 또 플레이타임, 추억의 국민학교 떡볶이 등 가족단위 고객을..."
